news_content,impact_type
"So far, sobriety efforts and particularly mild weather have succeeded in avoiding the dreaded blackout. According to the French Energy Regulatory Commission, there is no risk of a power cut before mid-January. Since August, we have consumed almost 11% less gas, compared with the same period in 2018. However, to compensate for nuclear and hydroelectric failures, France has never consumed so much gas for its electricity production - the country has twelve gas-fired power plants. GRDF, the main distributor of natural gas in France, thus speaks of a ""record"" year in 2022.",Risk
"The new delay in commissioning the Flamanville EPR, announced for the first quarter of 2024, is unlikely to improve the situation. It will exacerbate tensions over electricity supply in the winter of 2023-2024, in a context that is already extremely difficult due to the war in Ukraine and the reduction in Russian gas imports. In a recent study, the Shift Project anticipates that, in the event of a lasting halt to Russian gas supplies - which seems to be the path envisaged - the share of unidentified supplies within the European Union would reach no less than 40% of the Union's gas demand by 2025. This is equivalent to slightly more than the total exports of Qatar, the world's leading gas exporter in 2021.",Risk
"""The advent of a constrained geostrategic regime"".
The cause: fierce competition for supplies in the liquefied natural gas (LNG) market. Today, Asia and Europe are the world's two biggest importers of natural gas. Demand from China in particular is set to continue growing at a steady pace. Added to this is the development of massive new needs elsewhere in Asia (India, Pakistan, Thailand, Bangladesh, Indonesia, etc.). However, according to the Rystad Energy data on which the study is based, the rate of coverage of these needs by long-term contracts is greater in Asia than in the European Union up to 2035.",Risk
"""Supply tensions are likely to worsen, given the expected growth in Asian import requirements on the one hand, and the slow implementation of European fossil fuel phase-out targets on the other. This risk seems to confirm the advent of a geostrategic regime systematically exercised under constraints of energy and material availability. A formidable regime for importing powers"", explains the Shift Project.",Risk
"26 new LNG regasification terminal projects launched in the EU
This pressure on global LNG demand will lead to high and volatile prices, all the more so if the EU has to resort to short-term contracts, threatening European manufacturers already asphyxiated by the current price surge. On the production side, the Shift Project points out that the United States and Qatar could occupy increasingly dominant positions, jeopardizing European sovereignty. After Qatargate in Parliament, Qatar did not hesitate to use the gas dependence of European economies as a deterrent against any sanctions. It remains a controversial country for its lack of respect for human rights, as explained in the study dedicated to the subject, published on Novethic Essentiel.",Risk
"Finally, in addition to the question of supply, there remains the question of the ability of EU countries to develop regasification infrastructures to meet LNG import requirements. ""The Shift Project points out that ""problems with the availability of LNG tankers, storage capacity and transport capacity after regasification can lead to a number of bottlenecks. Since the start of the war in Ukraine, 26 new LNG regasification terminal projects have been launched in the EU, including 11 in Germany alone, according to a Global Energy Monitor report.",Risk
"For the NGO, ""these project proposals threaten to derail the EU's climate goals while doing little to address the energy crisis, as most of the LNG contracts secured at this stage by EU buyers are expected to start from 2026 for 15 to 20 years"". As a reminder, full implementation of Fit for 55 should reduce EU gas consumption by 30% by 2030. As the Shift Project points out, ""the transformation towards a European economy that is low in energy and materials is an existential challenge"".",Risk
"While public transport is the key to decarbonization, the Ile-de-France network is on the verge of chaos. Interminable waits, crowds at the doors, overcrowded trains... Service, reduced during the Covid-19 pandemic, has not resumed at 100%. And yet, needs are growing every year. The price hike on January 1, 2023 only serves to heighten users' anger.",Risk
"Faced with this situation, 50 mayors have signed the ""Stop Galère"" petition calling for a freeze on fares and a return to 100% service, reduced during confinements. This is a ""social and climatic imperative"", they claim. Public transport, essential to millions of people in Paris and the suburbs, is also a key factor in the ecological transition. An alternative to the use of private cars, whose greenhouse gas emissions are considerable - 16% of France's total emissions in 2019, and almost half of the transport sector's, according to the French Ministry of Ecological Transition.",Risk
"Savings achieved by reducing service
First of all, Île-de-France Mobilités' short-term management is criticized. Even after Covid-19, service on certain lines was reduced in order to save money. Now, Valérie Pécresse, President of the Region in charge of public transport, is calling for a return to 100% service. But ""RATP is not in a position to restore service, mainly due to a lack of staff"", says Michel Babut. ""Subway drivers should be recruited by the end of December, but for buses, the necessary recruitment will not be completed before spring"", he continues. Bus drivers are not rushing to the door because of the difficult working conditions and inadequate pay, a disaffection observed throughout France.",Risk
"In addition to the chaos of this post-Covid recovery, there are fundamental problems affecting buses, RERs, metros and streetcars alike. On the one hand, strikes are multiplying. According to Michel Babut, this ""gloomy atmosphere"" is exacerbated by ""the fact that RATP buses will be put out to tender in 2025, calling into question the status of employees"". ""Absenteeism is at an all-time high"", he explains. What's more, the equipment has aged and become less reliable.",Risk
"A growing need for public transport
Although the network is vast, it is no longer sufficient to meet growing needs. According to the Apur (Atelier parisien d'urbanisme), travel in Paris increased by 34% between 2001 and 2018, all modes combined. Car travel has fallen slightly, while walking, cycling and the use of public transport have increased, ""in line with the increase in supply and the extension of the territory served"", says the Apur.",Opportunity
Île-de-France Mobilités has indeed made investments to expand the network as part of the Greater Paris strategy and in anticipation of the Olympic Games in 2024. But the already staggering costs involved leave no room for maneuver to launch new investments or to meet employees' expectations.,Risk
"Île-de-France Mobilités' debt is now close to 6 billion euros. The challenge now is to find new funding. Operating costs, at 9.8 billion euros in 2018, are mostly financed by employers via their mobilités payments and season ticket reimbursements, 27% by passengers, and 18% by local authorities, according to Île de France Mobilités. Transport Minister Clément Beaune has announced for 2023 ""a conference with the State, the region, local authorities and users to organize transport and its financing over several years"".",Opportunity
"Now that the MidCat project has been buried, a new pipeline project has been launched to link the Iberian Peninsula to northern Europe, via France. Called BarMar, it will link Barcelona to Marseille by sea and should transport green hydrogen produced from renewable energies by 2030. However, concerns have been expressed about the wisdom of launching such an infrastructure without being sure that renewable electricity production capacity, which is set to grow sharply, will follow, and before knowing exactly what the market needs.",Opportunity
"Goodbye MidCat, hello BarMar. While the gas pipeline project linking France to Spain via the Pyrenees was finally abandoned in the face of Emmanuel Macron's fierce opposition, a new pipeline project will replace it, linking Barcelona to Marseille by sea. To be more precise, this is a ""hydrogen pipeline"", which, as its name suggests, will transport hydrogen from the Iberian Peninsula to northern Europe, particularly Germany, by 2030.",Opportunity
"The project, also known as H2Med, is part of the European Union's hydrogen strategy and is designed to transport green hydrogen, produced from renewable electricity or nuclear power, in the France-Spain direction. The agreement in principle initially mentioned that it could transport natural gas on a transitory basis, which caused concern among many observers. They pointed the finger at a disguised gas pipeline, and an expensive stranded asset - the project is estimated to cost 2.5 billion euros. In the end, however, it will only transport hydrogen, so that it can be declared a ""project of common interest"" and benefit from European funding.",Opportunity
"""Hydrogen production and consumption areas are still being defined"".
 Although less controversial than MidCat, the BarMar project is nonetheless the subject of criticism. In addition to the pipeline's impact on an area rich in biodiversity, experts question its relevance. ""Today, this has not been demonstrated, and the project raises more questions than it answers. On the one hand, there are the risks involved in transporting hydrogen, which is a real technical challenge. On the other hand, I wonder whether it makes sense to transform renewable electricity into hydrogen in a context of massive electrification of uses to move away from fossil fuels"", analyzes Phuc-Vinh Nguyen, researcher on French and European energy policies at the Institut Jacques Delors.",Risk
"Last September, Emmanuel Macron explained that several experts had alerted him to the fact that ""it would be absurd to transport hydrogen from Spain to France, or from Spain to Germany. What would have to be transported is the low-carbon electricity produced in Spain, to be used for electrolysis at the production sites that would need the hydrogen. We need more electricity interconnections; I'm not convinced we need more gas interconnections, which have greater consequences for the environment and ecosystems in particular"". Meanwhile, the President seems to have changed his mind.",Risk
"The consumption of low-carbon hydrogen also remains an unknown. ""It's not yet clear whether it will be worth transporting hydrogen between the Iberian Peninsula and France. The production of low-carbon hydrogen is currently almost non-existent, and the consumption channels have yet to be built up in part, although it seems clear that hydrogen will be used mainly to decarbonize industry. Production and consumption zones are therefore still being defined, making it difficult to plan transport infrastructures"", analyses Inès Bouacida, Climate-Energy researcher at the Institut du Développement Durable et des Relations Internationales (Iddri).",Risk
"Industry spearheads the sector's expansion
In France, hydrogen accounted for just 0.6% of industrial energy consumption in 2021, but its development is set to follow the most ambitious scenario imagined by the industry, with over 250 projects identified and 225 vehicle recharging stations by 2025. These are the findings of a new study published on December 7 by France Hydrogène. Consumption of low-carbon, renewable hydrogen is expected to exceed 1 million tonnes per year by 2030.",Opportunity
"A particularly important obstacle to overcome is access to ""abundant and affordable low-carbon or renewable energy"", emphasizes Philippe Boucly, President of France Hydrogène. This is a point that the government will have to take into account when updating its national strategy for the development of hydrogen, expected by the end of the first half of 2023. But also in the evaluation of the BarMar project...",Risk
"The French National Assembly's first reading of the Renewable Energies Acceleration Bill ended on Thursday night, December 19. A formal vote is scheduled for January 10. It is expected to be favorable, even if some fear that the vote will be overshadowed by the government's presentation of its pension reform on the same day... Novethic has selected the five key measures of the text.",Opportunity
"1/ The overriding public interest requirement reinstated
The National Assembly has reinstated Article 4, which had been deleted by the committee to the great displeasure of the government. This article aims to recognize the imperative reason of major public interest (RIIPM) for renewable energy projects, in order to avoid certain disputes that slow down their deployment. In committee, opponents had criticized a threat to the preservation of biodiversity. ""This recognition raises renewable energies to the level of projects of general interest to the country. It removes an administrative procedural step without in any way calling into question the very strict framework for the protection of biodiversity"", rejoices the Syndicat des énergies renouvelables in a press release.",Opportunity
"2/ Mandatory solar panels on large parking lots
After debates marked by a series of consensuses, a threshold of 1,500 square meters was finally retained for the mandatory installation of solar panels on outdoor parking lots. At least half the surface area will have to be covered with photovoltaic panels for the production of renewable energy. The deputies also made penalties mandatory, up to a maximum of 40,000 euros depending on the size of the parking lot. The measure must be applied by July 1, 2026 for the largest parking lots, and July 1, 2028 for the smallest.",Opportunity
"3/ The last word to the mayors
This was another major bone of contention. In the end, local authorities will be able to indicate areas where renewable energy projects can be accelerated, in particular through tax incentives. For the application phase of these priority or favourable zones, the mayor's assent will be required. For locations outside these priority zones, the LR deputies failed to obtain a right of veto from the mayors on any given project. The government is arguing for a balance between zones where renewable energies will be favored, with the assent of mayors, zones where all projects will be excluded, and neutral zones, with no prohibitions or incentives.",Opportunity
"4/ Mapping priority areas for offshore wind farms
Another measure aims to facilitate the launch of new projects through less complex consultation procedures with local stakeholders. It introduces planning for offshore wind power. The first ""priority"" zones are to be mapped out by 2024. These will have to be located in the exclusive economic zone, at least 22 km from the coast. But this is not an obligation, much to the dismay of MPs from various benches. Emmanuel Macron has set the goal of deploying 50 offshore wind farms to reach 40 gigawatts by 2050. This is ""the equivalent of 20 nuclear power plants"" and ""will enable us to move away from our dependence on fossil fuels"", insisted Energy Transition Minister Agnès Pannier-Runacher during the debates.",Opportunity
"5/ Taking visual saturation into account
Members of parliament have maintained an article in the bill on renewable energies stipulating that authorization to operate a wind turbine must take into account visual saturation and the need to diversify energy sources, despite the fears of the presidential camp that this would be a breeding ground for litigation. Added in committee on the initiative of ecologist Delphine Batho, the article stipulates that authorization to operate a wind turbine in a given territory must take into account ""the electricity production capacity, the number of installations (...) already existing in the territory concerned, the need to diversify renewable energy sources locally and to prevent the effects of visual saturation"".",Opportunity
"France has just officially notified its withdrawal from the Energy Charter Treaty (ECT), an agreement accused of blocking the energy transition. Some twenty organizations are now calling on the government to work on a coordinated withdrawal from the European Union. The modernization of the treaty is due to be put to the vote next April, and the aim is to secure a qualified majority by then. Read on.",Opportunity
"""Withdrawing France from the Energy Charter Treaty (ECT) is a good thing, but getting out of it jointly and in a coordinated way across the European Union is even better. This is the message that some twenty French civil society organizations, including Attac, the Collectif Stop CETA-Mercosur and France Nature Environnement, wish to convey in an open letter sent to Emmanuel Macron and the French government. On October 21, the French president, who had been under pressure for several months, announced his decision to withdraw from the TCE.",Opportunity
"Signed in 1994 at the end of the Cold War by some 50 countries, including all the European Union member states, the former Soviet bloc countries, Japan, Yemen and Afghanistan, the agreement was designed to facilitate energy relations throughout the Eurasian continent. But it is regularly challenged, as it gives multinationals and investors the right to take governments to court if they modify their energy policies in a way that runs counter to their interests. Last September, France was sued for the first time by a German investor.",Opportunity
"""A joint and coordinated withdrawal is not only necessary, but also possible"".
According to information revealed by the daily Le Monde, France has just officially notified its withdrawal, which will become effective in one year's time, on January 1, 2024. This makes France the second country to withdraw from the treaty, after Italy in 2016. However, a so-called ""survival clause"" means that states will continue to be subject to the treaty's provisions for a period of twenty years from the moment the withdrawal takes effect, i.e. until 2044... This is why the NGOs are calling for a collective withdrawal, and for the French government to work towards this goal.",Opportunity
"""Such a joint and coordinated withdrawal is not only necessary, it is possible. With Italy's withdrawal already effective, and the announced withdrawals of the Netherlands, Spain, Poland, Slovenia, Germany and Luxembourg, representing over 70% of the European population, and not counting the additional withdrawals that could still be announced, it is now conceivable to build a qualified majority of EU member states"", they write in their open letter.",Opportunity
"This is also the recommendation of the French High Council for the Climate, which published an opinion on the subject on October 19. ""A coordinated withdrawal from the TCE by France and the EU appears to be the least risky option for meeting national, European and international climate commitments"", say the authors. MEPs also voted on Thursday November 24 for a resolution calling for a joint and coordinated EU withdrawal from the treaty.",Opportunity
"The European Commission increasingly isolated
A few days earlier, on November 22, the treaty's modernization had not been ratified as planned, due to several European countries blocking the reform on environmental grounds. This blockage prompted the European Commission to request that the subject be withdrawn from the agenda, as validation of the reform would require a unanimous vote. The vote was postponed until April 2023.",Opportunity
"The French government therefore has a few months ahead of it to convince other countries to join the movement, and to change the position of the European Commission, which so far supports the modernization of the TCE. This position is becoming increasingly difficult to maintain, given that the Commission's Vice-President, Frans Timmermans, who is in charge of the Green Deal but not the TCE, declared in an interview with Le Monde at the end of November that it was ""more difficult every day to justify European participation in this treaty"".",Opportunity
"Car-sharing is taking its place in the arsenal of sustainable, shared mobility. The government has allocated 150 million euros to triple its use by 2027. Carpooling lines with dedicated stops, reserved lanes, online platforms... All means are available to encourage this mode of transport, which is particularly well suited to sparsely populated areas where public transport is difficult to set up.",Opportunity
"No longer a question of driving alone, the government is shifting up a gear to make carpooling a daily transport solution. ""Every day, around 100 million journeys are made by car to get to work, school or the shops, but the majority of these journeys are made with just one person in the car,"" points out the press release for the new Plan national covoiturage du quotidien, launched by the government.",Opportunity
"The aim is to triple the use of car-sharing by 2027, from the current 900,000 journeys per day, or around 1% of traffic, to 3 million, or 3% of traffic. The impact could be considerable, as car travel accounts for 15% of greenhouse gas emissions in mainland France. If the objective of tripling car-sharing is achieved, 4.5 million tonnes of CO2 per year, or 1% of France's annual carbon footprint, would be avoided. In addition to these positive effects on the climate, a reduction in road congestion and air pollution are also expected. A solution that is ""good for the planet and for purchasing power"", says the government, aware of these advantages in the face of rising fuel prices.",Opportunity
"""A turning point for mobility outside city centers"".
The €150 million plan focuses on daily commuting. Drivers carpooling using platforms such as Karos, Blablacar or Ecov will be eligible for a bonus of up to €100, the full amount being released after 10 journeys in three months. Not to be outdone, local authorities are now responsible for organizing carpooling in addition to other public transport networks. The government will take over part of the financial support for carpoolers already put in place by some of them, and finance carpooling areas or lines.",Opportunity
"Thomas Matagne, founder of Ecov, a car-sharing line operator, is delighted. These lines mimic the operation of a bus line, with no reservations and dedicated stops. On lines already installed, such as those in Reims and the Lyon area, Ecov reports an average waiting time of 4 minutes. On certain networks, the service also guarantees a maximum waiting time of 20 minutes, with the dispatch, in rare cases, of a cab taken in charge by the company, for example ""when the service is being primed"", explains Thomas Matagne.",Opportunity
"""In town centers, you can walk or cycle to the carpool stop. You can also reach carpooling areas by car"", describes Ecov's founder. ""It's a structural issue for suburban and rural areas, and we need to create a multimodal system like what already exists in cities,"" he continues. The system is proving its effectiveness, particularly in the Lyon metropolitan area, where Ecov has found that 21% of its users have parted with their vehicles and 21% are considering doing so. ""A very important step has been taken with politicians taking control, and this is a turning point for mobility outside city centers"", concludes Ecov's founder, confident in the ability of car-sharing to gain ""collective maturity"".",Opportunity
"""A necessary but not sufficient solution
Car-sharing is ""necessary but not sufficient"" to reduce CO2 emissions in France, moderates Laura Foglia, coordinator of the Shift Project's Short Distance Mobility Plan. This report, published in 2020, aims to reduce the car's share of journeys from 80% to 50%, and to make cars ""virtually disappear"" from city centers in favor of public transport such as buses and bicycles. But ""it's better to have a shared car than an almost empty bus"", says Laura Foglia, stressing the need to ""play on the complementarity of means of transport"".",Opportunity
"According to the Shift Project, car-sharing remains relevant in sparsely populated areas, where the average car occupancy is set to rise from 1.4 to 1.6 people. What remains is to reassure passengers who are ""afraid of being dependent, of not being able to get home later if something unexpected happens"", explains Laura Foglia. It is precisely to improve the car-sharing service and make it a truly ""free, reliable and high-frequency"" network that the government wants to act, retorts Thomas Matagne.",Opportunity
"As host of COP26, the UK has established itself as one of the world's climate leaders, waging war on fossil fuels and urging countries in the South to move away from them. But the British government has just sent out the wrong signal by approving a coal mine project in the north-west of England. Although the project will be used to fuel the steel industry, rather than to generate electricity, it has provoked fierce criticism at both national and international level.",Risk
