news_content,impact_type
"""While one out of every two cars sold today is an SUV, we're going to have to make a 90°C turn to move towards a smaller, lighter, lower-emitting fleet,"" explains Pierre Leflaive. The need for critical metals depends on the size of the battery and therefore of the vehicle. In addition, a recent study by Emissions Analytics shows that emissions from tire wear increase with vehicle mass, and are almost 2,000 times greater on average than emissions from tailpipes. Lighter vehicles will also be more accessible to those with lower incomes.",Risk
"But the issue of vehicle weight was not taken up by the MEPs. The issue will therefore be played out at national level when the 2023 Finance Bill is discussed in the autumn. Le Rac is proposing an amendment to lower the weight malus threshold to 1,300 kg (40% of the fleet) from 1,800 kg (2% of the fleet), and to introduce a new one for electric vehicles from 1,800 kg.",Risk
"Questioning current uses of the car
Other levers can be activated. These include, of course, alternative modes of transport such as public transport, trains, bicycles and even walking. Car pooling should also be encouraged. ""The car should no longer be seen as a private object, but rather as a service,"" explains Rac, who suggests setting up fleets of public vehicles. Last but not least, we need to reduce the number of trips we make, by getting closer to people on a daily basis and reducing the number of long-distance journeys.",Opportunity
"Aurélien Bigo points to other issues that will remain unchanged with the switch to all-electricity: ""the consumption of space by the car; transport infrastructures, leading to soil artificialisation and impacts on biodiversity; accidentology issues; physical inactivity and sedentariness"". In short, he says, ""electrification is essential if we are to achieve our climate objectives, but it's the unsustainability of current car use that needs to be questioned"".",Risk
"The decrees allocating the responsibilities of the various ministries were published in the Journal Officiel on Thursday June 2. Agnès Pannier-Runacher, Minister for Energy Transition, is responsible for energy transition, nuclear power and decarbonization of road transport. Housing, biodiversity and air pollution go to Amélie de Montchalin, Minister for Ecological Transition and Territorial Cohesion. According to Prime Minister Elisabeth Borne, this sharing of responsibilities is designed to steer a transition that must not disrupt the economy.",Risk
"We now know a little more about ecological planning, as conceived by Emmanuel Macron, with the publication of two decrees in the Journal Officiel on Thursday June 2. These detail the responsibilities of the now separate Ministries of Ecological Transition and Energy Transition. They share the responsibilities of Barbara Pompili, former Minister of Ecological Transition, and Jean-Baptiste Djebbari, former Minister of Transport.",Risk
"Amélie de Montchalin, at the Ministry of Ecological Transition and Territorial Cohesion, inherits in particular issues of sustainable development, biodiversity protection, town planning and the fight against urban sprawl. She will also be responsible for housing quality, energy efficiency and the fight against substandard housing - previously grouped under the Ministry of Housing.",Opportunity
"For her part, Agnès Pannier-Runacher, at Energy Transition, is officially responsible for defining and implementing ""energy policy, in particular to ensure security of supply and access to energy, combat climate change and promote the energy transition"". It will be responsible for the construction of new nuclear reactors, as well as for nuclear safety, through the General Directorate for Risk Prevention, which for the first time brings together in a single ministry the authority over the construction of power plants and the control of plant safety. It will also steer the decarbonization of road transport.",Risk
"Responsibilities split in two or three
The two new ministers, who are close to Emmanuel Macron, will have to manage a number of issues together. This makes governance a little more complicated... In fact, they will be sharing the Hôtel de Roquelaure on boulevard Saint-Germain. Building renovation and energy performance policy, for example, will continue to straddle the two ministries.",Risk
"Together with the Minister for Energy Transition, the Minister for Ecological Transition is also responsible for ""adaptation to climate change, air quality and technical regulations for vehicles"". The authority of the Directorate General for Energy and Climate (DGEC) is placed under the new Ministry of Energy Transition, but the Ministry of Ecological Transition has joint authority.",Opportunity
"More original, the Commissariat général au développement durable (General Commissariat for Sustainable Development) has been placed under the triple authority of the two Ministers for Ecological and Energy Transition and the Prime Minister, Elisabeth Borne. This body, created in 2008, steers the environmental dialogue on political choices and priorities through the Conseil national de la transition écologique.",Opportunity
"""No ecology against the economy"".
""Who steers environmental dialogue in France? The ministers' allocation decrees have been published, but they don't say who chairs the National Council for Ecological Transition. Is it the Prime Minister directly because she's in charge of ecological planning?"" wonders Anne Bringault, program coordinator at Réseau Action Climat France, on Twitter.",Opportunity
"In an interview with Le Point, published on Thursday June 2, Elisabeth Borne promises a radical transformation. But ""we will not make ecology against the economy"", warns the Prime Minister. The transition ""must never be at the expense of the most vulnerable French citizens"", she also assures us.",Opportunity
"Ministerial attributions do not yet allow us to have precise proposals on the first measures announced. These concern social leasing, to help the most modest to acquire an electric car, or the construction of six new third-generation EPRs. Ecological planning aimed at transforming France is yet to come.",Opportunity
"The number of journeys made by bicycle in towns and cities has risen by 42% compared to 2019, according to the association Vélo et Territoires, which took readings from almost 300 counters across France. While cycling is less popular in rural and peri-urban areas, the number of journeys there has risen by 27% compared to the pre-pandemic situation.",Opportunity
"As World Bicycle Day gets underway this Friday, the use of bicycles as a means of getting around is becoming firmly entrenched in French habits. In fact, according to Vélo et Territoires, in the first five months of the year, the number of journeys made by bicycle has risen sharply. They are 13% up on 2021, and 39% up on the situation prior to 2019 and the pandemic, according to the association's first assessment of the year. ""After another period of compulsory teleworking at the start of the year, life is gradually returning to normal. Barring the vagaries of the weather, attendance levels for 2022 are higher overall than those for 2021, and significantly higher than those for 2019"", says the association.",Opportunity
"Unsurprisingly, this craze is particularly strong in cities. In fact, the increase in bicycle journeys in cities is 42% compared to 2019, with an even stronger increase on weekdays than at weekends. ""The resumption of face-to-face work is boosting weekday use,"" says the association. ""The use of utility bikes now seems to be well established, and probably explains the strong growth recorded on weekdays in urban areas"", adds Vélo et Territoires. In Paris, the number of bike journeys is up 78% on 2019, and 22% more than last year. In Annecy, too, enthusiasm for cycling is strong, with the number of journeys up 74% on 2019 and 25% on 2022. In Dunkirk and Grenoble, the increases also exceed the city average.",Opportunity
"""Cycling practices in rural and suburban areas still fragile"".
By contrast, the number of bicycle passages is stagnating in peri-urban areas. ""The 3% increase on weekdays (compared with 2021) cannot offset the 11% drop on weekends"", says Vélo et Territoires. The same is true in rural areas, where cycling has stabilized compared with last year. ""The 4% increase in weekday use balances out the 8% drop at weekends"", notes Vélo et Territoires. It points out that these areas are undoubtedly more conducive to leisure activities, and that cycling has therefore suffered from less favorable weather conditions for cyclists at weekends and during school vacations. ""Cycling practices in rural and suburban areas remain fragile"", concludes the association. However, compared to 2019, the number of bicycle trips increased by 27% in suburban and rural areas.",Opportunity
"According to the Fondation pour la Nature et l'Homme, one in two French people is now willing to cycle for his or her daily commute if there is good cycling infrastructure. The size of the bicycle market in France is growing all the time, representing 4% of all journeys in France, with 8% of daily ""velotafeurs"". This boom in the sector is also having an economic impact, with sales of the cycle market jumping by 25% in 2021, according to the Union Sport et Cycle. Bicycles are the best-selling means of locomotion in France: in 2021, over 2.7 million bicycles were purchased, compared with 1.65 million cars. The challenge now is to maintain this trend and, above all, to make this means of transport attractive in the countryside.",Opportunity
"At their summit meeting, the leaders of the 27 countries of the European Union approved a sixth set of sanctions against Russia. They finally agreed to cut their imports of Russian oil by 90% by the end of the year, in order to dry up funding for Moscow's war in Ukraine. However, exemptions were agreed for Hungary, Slovakia and the Czech Republic.",Opportunity
"After coal, Russian oil is now gradually being banned from the European continent. Meeting at a summit in Brussels on Monday May 30, European heads of state decided to impose an embargo on Russian oil transported by ship, which accounts for two-thirds of European purchases. This decision overrides Budapest's veto, and will enable Hungary, as well as Slovakia and the Czech Republic, three landlocked countries, to continue to be supplied by the Russian Druzhba pipeline. The embargo will take effect within six months for crude oil and eight months for refined products.",Opportunity
"""This will cut off a huge source of funding for Russia's war machine,"" tweeted European Council President Charles Michel. As a second step, the extension of the embargo to oil pipeline deliveries will be discussed ""as soon as possible"", with no deadline set. But with Berlin and Warsaw pledging to halt imports via the Druzhba pipeline, a total of 90% of Russian oil exports to the European Union will be halted by the end of the year, according to European Commission President Ursula von der Leyen and French President Emmanuel Macron.",Opportunity
"Russia has chosen to continue its war in Ukraine. As Europeans, united in solidarity with the Ukrainian people, we are taking new sanctions this evening. We have decided to put an end to 90% of Russian oil imports by the end of 2022.",Opportunity
"A total embargo on Russian oil a long way off
In a video posted on Facebook on Tuesday, Hungarian Prime Minister Viktor Orban, firmly opposed to a total embargo on Russian oil, welcomed the compromise reached. ""Families can sleep peacefully, we've ruled out the most far-fetched idea ever,"" he enthused. Budapest had made its green light conditional on guarantees of its energy security. On arriving at the summit, the nationalist leader had also demanded assurances in the event of the Droujba pipeline, which supplies his country via Ukraine, being cut off. Hungary, a landlocked country, relies on the Druzhba pipeline for 65% of its oil consumption.",Opportunity
"This is why it is asking for a delay of at least four years, and around 800 million euros in European funding, to adapt its infrastructures to a total embargo. This request has not yet been accepted. Ursula von der Leyen simply pointed out that the capacity of the Adria pipeline, which supplies Hungary via Croatia, could be increased by ""around 45 to 60 days"" and ""investments"", which she did not quantify. Prague, for its part, had asked for an eighteen-month adjustment period for refined products, which was accepted, according to Belgian Prime Minister Alexander De Croo.",Opportunity
"""Quarrels in Europe must stop"".
Earlier in the day, Ukrainian President Volodymyr Zelensky had called on EU leaders to ""stop bickering"" and adopt the sixth sanctions package quickly. ""The quarrels in Europe must stop (...), Europe must show its strength. Because Russia only understands the argument of force"", declared the Ukrainian leader via videoconference.",Opportunity
"The new sanctions package, which has been under negotiation for a month, also extends the EU's blacklist to some sixty personalities, including the head of the Russian Orthodox Church, Patriarch Kirill. It includes the exclusion of three Russian banks from the Swift international financial system, including Sberbank, the country's largest bank. The leaders also approved the granting of 9 billion euros to the Ukrainian government to cover its immediate liquidity needs in order to keep its economy running.",Opportunity
"The summit, which comes to a close this evening, must also address the continent's energy transition to do without Russian gas through the Repower EU plan, and the food crisis linked to the war in Ukraine, which threatens the African continent in particular. The question of a gas embargo is also on the agenda, as Poland, Bulgaria, Finland, and more recently the Netherlands and Denmark, have already seen their supplies cut off by the Kremlin.",Opportunity
"Europe's heads of state and government are meeting on Monday May 30 and Tuesday May 31 to discuss the Repower EU plan for the European Union's energy independence, presented by the Commission on May 18. Pressure is mounting to break our dependence on fossil fuels and speed up the energy transition, while experts are warning of an inevitable crisis surrounding liquefied natural gas.",Opportunity
"With the energy crisis exacerbated by the war in Ukraine, demand for liquefied natural gas (LNG) is set to outstrip supply by the end of the year, according to research by Rystad Energy. Global demand is thus expected to reach 436 million tonnes in 2022, outstripping available supply, which is estimated at 410 million tonnes. ""A perfect winter storm could form for Europe as the continent seeks to limit Russian gas flows,"" the analysts warn. They argue that relief could only come after 2024.",Opportunity
"""There simply isn't enough LNG to meet demand. In the short term, this will lead to a harsh winter in Europe. For producers, this suggests that the next LNG boom is here, but it will come too late to meet the surge in demand. The stage is set for a sustained supply deficit, high prices, extreme volatility, bull markets and increased LNG geopolitics,"" warns Kaushal Ramesh, Senior Analyst for Gas and LNG at Rystad Energy.",Opportunity
"Engie committed to LNG project until 2041
Last year, Russia sent 155 billion cubic meters of gas to Europe, providing over 30% of the region's supply. To facilitate additional LNG imports, numerous regasification terminals have been planned across Europe - some new, others reactivated after a deep slumber. And more than 20 LNG projects with a combined capacity of over 180 million tonnes per year have recently registered development progress.",Opportunity
"American projects such as Energy Transfer's Lake Charles and NextDecade's Rio Grande have been relaunched. French energy company Engie, for example, has just committed to buying shale gas LNG from 2026 to 2041 via the Texas Rio Grande LNG terminal, currently still at the project stage. In 2020, however, Engie and the French government, which holds a 23.6% stake in the energy company, abandoned negotiations with NextDecade due to the environmental impact of the project, which is the subject of considerable controversy and strong opposition from local communities.",Risk
"""Just a few days after the start of Emmanuel Macron's second term in office, and at a time when he was trying to green his image between the two rounds, this shale gas import contract is a terrible signal for the next five years. With the complicity of Engie and Société Générale, the government is burying French and European climate objectives"", denounces Lorette Philippot, finance and fossil fuels campaigner at Friends of the Earth France.",Opportunity
"Complaint lodged against the EU
At their summit meeting on May 30 and 31, Europe's heads of state and government are due to vote on the Repower EU plan, presented by the European Commission on May 18, designed to end our dependence on Russian hydrocarbons as quickly as possible. The plan sets out ways of speeding up the energy transition, but also relies on the development of LNG supplies. Pressure is mounting to move away from fossil fuels.",Opportunity
"On May 25, a complaint was lodged with the European Union Ombudsman by the Global Legal Action Network (Glan), supported by NGOs such as Notre Affaire à Tous. They accuse Brussels of not doing enough in the face of the Ukrainian crisis, and of exacerbating the climate crisis. In particular, they point the finger at the construction of new fossil fuel infrastructures without having assessed the ""lock-in"" risk they represent. ""This is precisely what the UN Secretary General described as 'moral and economic folly' following the publication of the latest IPCC report"", denounces Glan.",Opportunity
"In an open letter sent to the President of the European Commission on May 11, more than 120 top business leaders (including EDF, Eiffage, Nestlé, Unilever and Microsoft) urged the European Union to speed up the green transition and adopt an ""ambitious"" Fit for 55 package to strengthen the continent's energy security and the competitiveness of its industry, and stay on a trajectory compatible with a warming of 1.5°C.",Opportunity
"Nuclear power is one of Emmanuel Macron's main energy priorities. The re-elected president has done an about-face on the subject. At the start of his first five years in office, he had hoped to close a dozen reactors by 2035, but is now aiming to build at least six new EPRs. But the industry is experiencing a series of setbacks.",Opportunity
"1) Corrosion problems: 12 reactors shut down
12 of the 56 reactors in operation have been shut down due to a corrosion problem detected at the end of last year. The problem seems to affect the latest-generation reactors in particular, the fewest in number but the most powerful. The Chairman of the French Nuclear Safety Authority (ASN) says that dealing with these problems ""will take several years"" and that ""additional shutdowns could occur"". ""EDF is continuing its inspection program and is working with the nuclear industry to repair the sections of piping concerned"", explains the energy company, which has had to revise its production outlook downwards yet again. By 2022, it could fall below the unprecedented 300 TWh mark.",Opportunity
"2) Choosing between safety and electrical safety?
At present, more than half of our power plants are shut down, not only for corrosion problems, but also for maintenance, refuelling and the Covid-19 ten-yearly outage program. This historically low level of production poses risks for electricity supply, against a backdrop of energy crisis exacerbated by the war in Ukraine. This may have consequences for safety, as we could find ourselves having to choose between shutting down a reactor or supplying electricity. ""ASN has repeatedly expressed the need to maintain margins in the sizing of the power system and facilities, to be able to cope with contingencies. Today, however, there is no margin!"" reacted ASN Chairman Bernard Doroszczuk in an interview with Le Monde in January.",Risk
"3) The growing threat of climate change
At the beginning of May, the Blayais nuclear power plant in the Gironde region of France was forced to slow down its operations due to hot weather. Power was reduced from 900 MW to 100 MW for a few hours. To cool its reactors, the plant pumps water from the river, then discharges it, but this discharged water must not exceed 30°C in winter. This is an unprecedented situation for the month of May, but one that is likely to recur as a result of climate change. According to RTE, ""in the event of increasing drought and heatwaves, and in the absence of further adaptations by the operator, there could be production losses on some sites, particularly on the Meuse"". Around 10% of installed capacity has already been affected by simultaneous heatwaves and droughts.",Risk
"4) Accumulation of spent fuel
All the fuel irradiated in French power plants to produce electricity converges on the La Hague pools for cooling, before being reprocessed by Orano. But these pools could reach saturation before 2030. However, the new pool planned by EDF, also on the La Hague site, will not be available before 2034, and is facing local opposition. Orano is also experiencing problems with its Melox plant for manufacturing MOX [a fuel composed of plutonium and depleted uranium], which is operating at half-capacity and producing a lot of scrap, also saturating storage sites. ""Each of these events, if they worsen, could by ricochet and systemic effect weaken the operation of the power plants"", warned the ASN.",Risk
"5) Flamanville project delayed again?   
""The nuclear industry is suffering from a shortage of specialized welders. So much so, in fact, that EDF is considering further delaying the Flamanville (Manche) EPR construction site, in order to ask the teams on site to go and help out at other power plants."" This was revealed in the April 27 edition of Le Canard Enchaîné. Under construction since 2007, the Flamanville EPR was due to go into service in 2012, but it has been plagued by setbacks and cost overruns (12.7 billion euros). Its startup has again been pushed back to the second quarter of 2023. In England, the Hinkley Point EPR, supported by EDF, is also experiencing significant cost overruns and further delays, with commissioning scheduled for 2027. This is all the more worrying given President Emmanuel Macron's pledge to build six new EPR2s (second-generation EPRs that are simpler and less costly than the Flamanville EPR) and the launch of studies for eight additional EPR2s.",Risk
"After long days of anticipation, Elisabeth Borne's government was unveiled mid-afternoon on Friday May 20. The appointments of the two ministers responsible for carrying out the transition alongside the Prime Minister were eagerly awaited by ecology specialists. They are Agnès Pannier-Runacher, Minister for Energy Transition, and Amélie de Montchalin, Minister for Ecological Transition and Territorial Cohesion. Two names that don't inspire much enthusiasm.",Opportunity
"Ecological planning finally has its trio. Emmanuel Macron had promised to appoint a Prime Minister ""directly responsible for ecological planning"", supported by two ministers, responsible for ""energy planning"" and ""ecological and territorial planning"". On paper, it's a done deal. Élisabeth Borne will be accompanied by Agnès Pannier-Runacher, appointed Minister for Energy Transition, and Amélie de Montchalin, appointed Minister for Ecological Transition and Territorial Cohesion.",Opportunity
"The re-elected president has opted for continuity, with two Macron loyalists who were already present in Jean Castex's previous government, but on subjects rather removed from the ecological and energy transition. Agnès Pannier-Runacher was in charge of Industry and Amélie de Montchalin of Transformation and the Civil Service. Reactions - mixed - were not long in coming. Former LREM MP Matthieu Orphelin deplored ""two choices that are more than surprising given their previous modest positions on these issues..."".",Risk
"The Prime Minister also announced the creation of a General Secretariat for Ecological Planning. Reporting to her, it will be responsible for coordinating the development of national strategies for climate, energy, biodiversity and the circular economy. It will also ensure that the commitments made by all ministries in the environmental field are properly implemented. Antoine Pellion has been appointed Secretary General for Ecological Planning. He will also act as advisor to the Prime Minister's office, as head of the Ecology, Transport, Energy, Housing and Agriculture division.",Risk
"Two highly technical backgrounds
A graduate of HEC business school, ENA and Sciences-Po Paris, Agnès Pannier-Runacher, 48 in June, worked in the private sector before joining the Inspectorate of Finances in 2000, then Assistance Publique-Hôpitaux de Paris, and Caisse des Dépôts. She was one of Emmanuel Macron's early supporters in the 2017 presidential election. During her term of office, Agnès Pannier-Runacher was awarded a ""casserole d'or"" by the anti-corruption association Anticor for having ""exerted pressure on several opposition elected representatives to dissuade them from referring the draft law on the acceleration and simplification of public action to the Constitutional Council"".",Opportunity
