news_content,impact_type
"The measures taken respond to ""both short-term and long-term challenges. They provide for changes in behavior, but also structural changes with a diversification of supplies to meet the challenges of energy sovereignty"", stresses a government spokesperson. However, everything will depend on the effective implementation of sobriety measures by companies, as no compulsory measures are planned. To ensure that the plan works, the government plans to regularly measure the sobriety trajectory. ""We will be monitoring electricity and gas consumption on a weekly basis, and comparing it with previous years. This will be cumulated with a monthly update by the network operators (RTE for electricity, GRT for gas, editor's note)"", explains the government.",Opportunity
"Germany, on the other hand, has chosen to impose binding measures on certain companies. Since October 1, companies consuming more than 10 gigawatt-hours per year have been required to carry out energy audits to assess potential savings and renovate their lighting and heating systems. Since then, they have also been required to implement energy-saving plans, involving changes such as switching to LED lighting, or optimizing production processes. However, all these measures will have only a limited effect, with total gas consumption falling by only 2%, according to the German Ministry of Economic Affairs.",Opportunity
"Taking it a step further
NGOs are already calling on the government to go one step further. ""There are a number of good levers, such as the 19°C temperature limit or the 110 km/h freeway speed limit,"" notes Anne Bringault, program coordinator for the Climate Action Network, speaking to France Inter. But the plan still lacks scope, in her opinion. ""This first sobriety plan focuses solely on the energy aspect, but we're going to have to tackle the other aspects (buying new clothes, meat consumption, polluting vehicles, etc.) which are going to turn our production and consumption patterns upside down"", she adds.",Opportunity
"This analysis is shared by the Négawatt association, which in late September published some fifty quantified sobriety action proposals to reduce our energy consumption by at least 10% within the next two years. ""For us, sobriety isn't just about getting through the winter, it's about structuring policies over the long term, such as urban planning or training professionals in the field"", pointed out Stéphane Chatelin, director of Négawatt, at a press conference. According to Négawatt, restrictive regulatory measures, such as the generalized lowering of speed limits on freeways and expressways, would have had a more significant impact.",Opportunity
"A new study published by PwC shows that none of the G20 countries has taken the necessary steps to decarbonize their economies at the pace imposed by the Paris Agreement. This postpones the effort to the coming years, with carbon intensity now set to fall by an annual average of 15.2%... compared with 0.5% by 2021. In France in particular, greenhouse gas emissions stagnated again in the first half of 2022, contrary to the commitments made.",Opportunity
"From now on, we'll have to move eleven times faster to decarbonize our economies. This is shown by the latest edition of the Net Zero Economy Index, published by PwC and based on fossil fuel emissions in the G20 countries. None of the top twenty economies - which account for 80% of the world's energy-related emissions - has achieved the required -5% decarbonization by 2021. On average, carbon intensity (i.e. CO2 emissions per point of GDP) in the G20 fell by just 0.5% last year, the lowest level in two decades.",Opportunity
"""This year's results are an urgent reminder that we must act to achieve ambitious carbon neutrality targets,"" reacts Emma Cox, global climate manager at PwC UK. ""We now need to achieve an annual decarbonization rate of 15.2% to close the gap between climate urgency and a strong, sustainable economy,"" adds Dan Dowling, Partner, Net Zero Strategy and Transformation. This equates to a 77% reduction in carbon intensity by 2030 to limit global warming to 1.5°C.",Opportunity
"Record reductions in CO2 emissions in China
In detail, in 2021, the best-performing country in terms of decarbonizing its economy was South Africa (-4.6%), ahead of Australia (-3.3%) and China (-2.8%). Beijing has just posted its fourth consecutive quarterly drop in greenhouse gas emissions, with a record -8% from April to June 2022, according to data published by Carbon Brief.",Opportunity
"""The latest quarterly decline was driven by the ongoing real estate crisis in China, Covid's strict control measures, weak growth in electricity demand and strong growth in renewable energy production,"" explains the site. ""If this data is confirmed and prolonged, it would be excellent news in the fight against global warming,"" reacted economist Maxime Combes on Twitter.",Opportunity
"""Very alarming results"" in France
By contrast, the USA (+0.1%), India (+2.9%), Japan (+0.6%), Germany (+1.7%) and France (+1.4%) all saw increases in their carbon intensity in 2021, partly due to the post-pandemic recovery. France, which remains the most carbon-free economy in the G20, saw its greenhouse gas emissions rise by 6.4% compared with 2020. According to the Climate-Energy Observatory, set up by the Climate Action Network (RAC), France is thus failing to meet its net emissions target for 2021. ""The main discrepancy is due to the lower absorption of emissions by forests and soils"", warns the RAC.",Opportunity
"For the first half of 2022, Citepa's initial estimates are not encouraging either, with emissions down by just 0.6%. As a reminder, France must reduce its emissions by 4.7% per year until 2030. The biggest increase was recorded in the transport sector, with +7% compared with the first half of 2021. By contrast, industry is down by 5%, and the tertiary residential sector by 13%.",Opportunity
"""These very alarming results concerning greenhouse gas emissions in Q1 2022 should be an electroshock for parliament: not to cut climate-damaging spending in the PLF2023 (finance bill, editor's note) and under-invest in the transition would be irresponsible,"" comments Anne Bringault, RAC's program coordinator, on Twitter. Members of parliament have just begun examining the Finance Bill for 2023, which includes a 45 billion euro budget for the tariff shield.",Opportunity
"In October, the French government intends to present a bill to accelerate nuclear power, the second pillar of Emmanuel Macron's energy strategy, along with renewable energies. The aim is to lay the foundation stone for the future EPR before 2027. But for the NGOs, this timetable takes no account of the debate due to be held next year in Parliament on France's energy future. They denounce this as a parody of consultation.",Risk
"Following on from its bill to accelerate the development of renewable energies, presented to the Council of Ministers earlier this week, the government is now tackling the nuclear sector, in order to double its efforts. It has just submitted for consultation a text designed to facilitate the commissioning of six new-generation reactors on existing sites, by simplifying administrative procedures, such as town-planning law, or the process of dispensing with the principle of prohibiting the destruction of protected species.",Risk
"""We already know these sites from an environmental and archaeological point of view. We already know that they are artificial, so we can say that we can go faster in the administrative instruction phases, because we're not going to learn anything special,"" explains Agnès Pannier-Runacher, the French Minister for Energy Transition. ""It's basically a common-sense measure to save time and ensure our country's energy independence,"" she told Europe1.",Risk
"""A parody of consultation
The government hopes to lay the foundation stone for a new EPR2 before the end of the five-year term in 2027, with commissioning scheduled for around 2035, or even 2037. The target sites are Penly (Seine-Maritime) and Gravelines (Nord). The third pair of reactors has not yet been decided, but ""the logic, in terms of network balance, would be to locate them in the Rhône valley"", said the Ministry. The aim is to present the text to the Council of Ministers ""in the middle of October"".",Risk
"However, the NGOs involved in the consultation process are critical of the forced timetable. They have until October 5 to reach a decision. ""Allain Bougrain-Dubourg, President of the French League for the Protection of Birds (LPO), deplored ""a parody of consultation"" and the absence of environmental impact studies. For her part, Anne Bringault of the Réseau Action Climat (RAC) denounced ""a completely short-circuited environmental dialogue on the subject of nuclear power"".",Risk
"The future of the energy mix to be debated in 2023
A public debate will be held from October 27 to February 27 on the construction of six future reactors. And the new Multiannual Energy Program (PPE), covering the period 2023-2028, is due to be debated in Parliament and adopted in 2023 as part of the next energy-climate programming law. A national consultation on the future French energy-climate strategy (which includes the PPE) is also due to be launched in the coming weeks.",Risk
"""The government is proposing to start building reactors first, and then ask questions about the strategy that should lead us to carbon neutrality in 2050. It's a world turned upside down"", says France Nature Environnement (FNE), pointing out that several scenarios on the major energy options for France have been drawn up, by RTE and Ademe in particular. ""Collectively, let's study the different possible scenarios. Collectively, let's decide on our energy future. And then, let's speed up its implementation"", stresses Arnaud Schwartz, President of FNE.",Risk
"In a press release published on September 27, the French National Commission for Public Debate (CNDP) also points out that ""EDF has referred its proposal for a new nuclear program, including the project to build two EPRs on the Penly site, to the CNDP"" and that it is ""only at the end of this public debate and in consideration of the public's observations and proposals that the government will be able to submit to Parliament its proposal to relaunch a new nuclear program"".",Risk
"This is one of the main environmental decisions in the Finance Bill for 2023: the end of export credits for fossil fuel projects abroad across the entire value chain, from exploration and production to transport and storage. This commitment was made by France at COP26 in Glasgow a year ago, and is now coming to fruition. However, there are still exceptions for gas- and oil-fired power plants.",Opportunity
"The 2023 budget, presented to the French Council of Ministers on Monday September 26, commits to no longer granting export credits for fossil fuels, from upstream exploration and production to downstream refining, transport and storage, as of January 1, 2023. Through its export credit agency (Bpifrance Assurance Export), the French government supports the export activities of companies operating on its territory, acting as insurer of last resort. This public insurance, known as export guarantees, makes it easier for companies to obtain loans from commercial banks.",Opportunity
"In concrete terms, this means that TotalEnergies or its subcontractors, for example, will no longer be supported by France in their fossil fuel projects in Qatar or Uganda,"" explains Anna-Lena Rebaud, of the NGO Friends of the Earth France. This is a decisive step forward. What's more, France's policy is rather ambitious, since it will be implemented from the end of the year, and the exceptions do not apply when the lifespan of existing installations or their production capacity is increased"", she explains.",Opportunity
"Exceptions for gas- and oil-fired power plants
At COP26 in Glasgow in 2021, France was slow to commit to the issue. Under pressure from civil society, it finally joined the Glasgow Declaration, a coalition of stakeholders aiming to end all new foreign public support for the fossil fuel sector by the end of 2022. To date, only five players or countries have taken effective action. But while the French decision is welcomed, one notable exception remains: gas- and oil-fired power plants are not covered.",Risk
"""Investing in this type of project today, and building up the dependence of regions on hydrocarbons for decades to come, is neither beneficial for the climate nor for the energy transition of countries in the South. This diverts capital from real solutions and slows the development of renewable energies"", deplores Friends of the Earth. The 2023 budget also includes an exception for ""operations with the effect of reducing negative environmental impact"". This means that the state could support technologies such as carbon capture and storage, which are not yet mature and remain very expensive.",Risk
"This decision sets a standard for fossil fuel finance
""The fact remains that this is an important victory on which we can build, by trying to get other countries on board, as well as private players. This decision sets a standard for fossil fuel finance. All French banks must align themselves with it"", argues Anna-Lena Rebaud. ""It also strikes a blow against TotalEnergies' strategy, which explains that it is necessary to develop oil and gas, and we hope that it will call into question their development plans"", she adds.",Opportunity
"Between 2016 and 2020, France supported oil and gas projects to the tune of almost 2 billion euros, mainly in the form of export guarantees. These include the gas exploitation and liquefaction project in the Russian Arctic, with a €350 million guarantee granted in 2017 to Technip, and the 879 km gas pipeline between Greece, Albania and Italy, with a €450 million guarantee granted in 2018 to Spiecapag, a company specializing in pipeline installation.",Risk
"The victory of Giorgia Meloni and her Fratelli d'Italia party opens, at the very least, a period of great uncertainty for the European Union. Although the future President of the Italian Council, the first woman to hold this position, has remained vague about her intentions and program, she is showing a willingness to renegotiate European commitments, starting with the 2020 recovery plan. She could do the same with the Green Deal, ""Italians first"" being a slogan hardly compatible with a global, coordinated greening of the Union's economy.",Risk
"Faced with major political and parliamentary instability, Italy will have to form a new coalition based on the results of the September 25 parliamentary elections, in which the alliance of three right-wing and far-right parties - Giorgia Meloni's Fratelli d'italia, Silvio Berlusconi's Forza Italia and Matteo Salvini's League - together won 44% of the vote. Giorgia Meloni has a clear advantage over her two running mates, since her party obtained more than 26% of the vote. This enabled her to claim the future presidency of the Council on Sunday night, and thus the steering of Italian politics.",Risk
"""It's a little early to really know what's going to happen in Italy,"" explains Joséphine Staron, director of studies at the Synopia think tank and author of the book ""Europe - la solidarité contre le naufrage"". ""That said, we can conclude from her statements that she will try to renegotiate everything, starting with Covid's post-epidemic recovery plan, which has already been completed. Her idea is to demand that part of the European funds be used to finance the energy shields of each member state. For the moment, however, this is completely out of the question.""",Risk
"""The threats are mainly to social rights"".
This potential strategy by one of the founding member states of the European Union will, at the very least, waste a lot of time on key EU commitments such as the recovery plan or potentially the Green Deal, which already lacks active political support. How far can Giorgia Meloni contribute to calling into question the Union's environmental commitments?",Risk
"""She has no hostility to the subject per se, like Marine Le Pen in France. On the other hand, she could add Italy to the clan of fierce renegotiators, those who want to call into question the European Union's areas of competence and the primacy of European law. There are already Hungary and Poland, and Sweden seems to be going down the same road, but at this stage the threats are much less to environmental commitments than to fundamental social rights such as abortion rights or policies to protect LGBT minorities"", analyzes the specialist.",Risk
"""At the COPs, the states are all trying to defend their own interests"".
What the four European states where populist and far-right parties have come to power have in common are immigration, morals and economic liberalism, with climate issues absent from political debates or even the economy. Obsessed by Italy's demographic decline, Giorgia Meloni has been following in the footsteps of the Fascist party for over 20 years, as shown in this France 3 report from 1996, and has made the fight against immigration her spearhead, to the point of considering a naval blockade of Libya.",Risk
"How, then, can we build a common dynamic to combat climate change across the European Union, with a state dominated by sovereignty and the desire to be responsible only for the direct emissions from its territory? ""COP's fail one after the other because of negotiations driven by states all trying to defend their own interests"", explained IPCC researcher François Gemenne, during a debate on the geopolitics of nature held in Nantes on September 24.",Risk
"""However, the European Union, which negotiates on behalf of all member states, weighs less and less in the global volume of emissions, and its share is tending to decrease. So, in principle, to be effective in the fight against climate change, it should act elsewhere in the world, on imported emissions, on the Amazon. Unfortunately, this is incompatible with the expectations of voters who want us to act on their territories and help them deal with the energy crisis,"" he adds. Giorgia Meloni's electoral success is bad news for the next COP 27, which is already off to a bad start!",Risk
"This Monday, September 26, the bill to accelerate the development of renewable energies arrives at the Council of Ministers. Long-awaited, the bill is designed to help France catch up in an increasingly tense environment. The main objective is to halve the time it takes to complete projects. But the debates are already shaping up to be stormy, with strong opposition from certain parties.",Opportunity
"The long-awaited bill to accelerate the deployment of renewable energies is due to go before the Council of Ministers on Monday September 26. The bill provides for 48 months of transitional measures to simplify procedures (e.g. extension of electronic public voting), increase the number of opportunities for solar panel installation (e.g. on abandoned motorways, degraded land, compulsory shading of existing parking lots, etc.), and mutualize discussions on offshore wind farms by coastline.",Opportunity
"The ambition is now to halve project completion times. After all, it took more than ten years - compared with five in Germany and six in the UK - for France to connect its first offshore wind farm. This was last week in Saint-Nazaire, in the presence of Emmanuel Macron. ""We are going to massively increase our electricity needs"", by ""40% between now and 2050"", and France will need to move ""twice as fast"" on renewable energy projects, ""wind and solar in particular"", stressed the head of state.",Opportunity
"""France is not on track with its energy transition"".
However, examination of the text promises to be difficult in the National Assembly, in the absence of an absolute majority and in the face of an extreme right and certain right-wing elected representatives who are up in arms against wind power. However, environmental NGOs have already denounced an article in the bill that would have raised the thresholds above which projects would have to undergo an environmental impact assessment, in violation of the principle of non-regression of environmental law. The article was eventually withdrawn.",Opportunity
"While waiting for the text to reach Parliament in October, the sector is counting on a recent circular asking prefects to ""facilitate the processing"" of applications. Over the past three years, onshore wind power developers have seen the number of permits issued plummet, pushing France further away from its targets. According to the Energy-Climate Observatory of the Climate Action Network (Rac), France is seriously lagging behind in renewable energies, with a 19.3% share of the energy mix in 2021, against a target of 23.7%.",Opportunity
"Still according to Rac, France has also missed its targets for fossil fuel consumption, overshooting the forecast trajectory by 15 terawatt-hours, equivalent to half the annual consumption of the city of Paris. ""France is not on track with the energy transition, leading to numerous risks on the power grid and a still high dependence on fossil fuels,"" Rac concludes.",Risk
"Budget marathon
Last February, Emmanuel Macron set the target of installing around 50 offshore wind farms in France by 2050. However, he has now put the brakes on onshore wind power, with current capacity to be doubled over thirty years rather than ten. He also announced a tenfold increase in installed solar power capacity by 2050, and a revival of nuclear power with the construction of six EPR2 reactors by 2035. ""All ENR doesn't work, all nuclear doesn't work"", Emmanuel Macron justified to supporters of both camps.",Opportunity
"In addition to the energy dossier, a budget marathon gets underway on Monday September 26. The Council of Ministers is expected to present the Finance Bill for 2023 (PLF), the ""green budget"", i.e. a summary of climate-friendly and climate-unfriendly spending, as well as the Public Finance Programming Act (LPFP) for the five-year period. ""Candidate Emmanuel Macron promised 10 billion euros a year for the climate, so we expect to find it here. Other elements to watch out for include the realization of the Green Fund for local authorities, measures concerning adaptation, energy renovation and the heat fund"", summarizes I4CE in a presentation to the press.",Opportunity
"The bicycle plan, whose success has already been proven, has been extended. In 2023, 250 million euros will be made available to support the purchase of bicycles, develop cycling facilities and train young people in cycling. The scheme, which is celebrating its fourth anniversary, will also address the challenges of rural areas. It's a good start, welcomed by the associations, who are nevertheless calling for a ""Marshall Plan for cycling"", with much greater investment.",Opportunity
"The government steps up a gear. Matignon announced on Tuesday September 20 the launch of a second plan to make France a ""cycling nation"". Endowed with 250 million euros for 2023 alone, it follows on from the cycling plan launched in 2018 by Élisabeth Borne, then Minister of Transport. The latter, endowed with 350 million euros over 7 years to which 150 million had been added from the stimulus plan, has seen its appropriations ""spent in just four years"", declared Christophe Béchu, Minister of Ecological Transition.",Opportunity
"A real success: by 2021, bicycles will have become ""the best-selling means of transport"", thanks to repair and purchase subsidies, according to French Prime Minister Elisabeth Borne. More than 2.7 million bicycles have been purchased, according to figures from the Union Sport & Cycle, boosting the market by 43% in value terms in just two years. But to reach the target of 9% of journeys made by bike by 2024, the government wants to ""go further"".",Opportunity
"This second plan will continue to develop cycling facilities, with 200 million euros earmarked for infrastructure and 50 million for parking. Subsidies for the purchase of bicycles will be maintained, and 800,000 young people should be trained to ""know how to ride a bike"". The Prime Minister also intends to structure a French bicycle industry, promoting assembly, recycling and repair. Finally, an inter-ministerial committee on cycling will meet every six months. For the following years, the government will develop its intentions in the ecological planning roadmap, according to Christophe Béchu.",Opportunity
"Boosting momentum in rural areas
The priority is now on rural and peri-urban areas, where cycling infrastructure is still underdeveloped. According to the latest bulletin from the Vélo et Territoire association, between January and September 2022, the number of bicycle trips increased by 33% in cities compared with 2019, compared with only 15 to 16% in the rest of the country. ""We've really boosted this momentum in the cities. Our challenge over the next few years is to demonstrate that cycling can also be a way of getting around in rural areas,"" acknowledges the Prime Minister.",Opportunity
