news_content,impact_type
"13-hour days, conflicts to manage, wages deemed insufficient... Public transport employees in the Paris region fear that their already difficult working conditions will deteriorate as the company opens up to competition. Competition is gradually being introduced, under the banner of cost-cutting. Service quality, already heavily criticized as a key factor in decarbonization, is also likely to suffer. More and more consideration is being given to postponing deadlines.",Risk
"The opening up of public transport in the Paris region to competition has raised fears of a deterioration in working conditions and service quality. A group of 250 elected representatives, including Paris mayor Anne Hidalgo, Seine-Saint-Denis departmental council president Stéphane Troussel, and La France Insoumise deputy Mathilde Panot, did not mince their words in an article published in Le Monde on Monday January 2.",Risk
"""Competitive operators cut costs as far as possible"".
 Some buses in the Greater Paris area have already been entrusted to the competition. In 2025, it will be the turn of all RATP-run buses. Then, progressively until 2039, the monopoly of RATP and SNCF in Île-de-France will come to an end. Île-de-France Mobilités has decided to do this in order to reduce costs and increase the pressure on transport operators to improve their results. Île-de-France Mobilités remains responsible for financing.",Opportunity
"However, employees are worried. ""Competing operators are cutting costs as far as possible, including the biggest item of expenditure in this type of service: the wage bill, which represents around 70% of the production price,"" states the article in Le Monde. The consequences are already being felt where staff numbers have been reduced. ""Increased rotations, longer working hours, shorter or even non-existent breaks, lower wages for equivalent working hours, lack of training, endangerment of staff and users"", it adds.",Risk
"""The profession has become tense"".
Working conditions, already unattractive as evidenced by recruitment difficulties, are increasingly deteriorating. ""Bus drivers also have to deal with safety issues, and have had to enforce sanitary measures without any pay increases,"" explains the transport consultant. ""We need to make these jobs more attractive, as human resources are essential to the operation of the network"", she assures us.",Risk
"""There's a new culture to be put in place, with greater expectations of productivity, but we also need to reach compromises to preserve local ecosystems. If the aim is only to reduce costs, we'll end up with social breakdown,"" continues Anouk Exertier. The experience of the United Kingdom, where the opening up of the railroads to competition was chaotic because the new transport operators were given too much freedom, serves as a warning.",Risk
"However, she admits that ""SNCF still has a lot of work to do on recycling plastic waste, not only from passengers, but also from station retailers, which represents large volumes"". The SNCF is considering several ways of reducing it: ""experiments should start in certain stations by next year"", Sophie Chambon tells AFP.",Risk
This sum will enable the energy company to deploy 10 gigawatts (GW) of additional storage capacity over the next 18 years. The utility isn't starting from scratch. It already operates 5 GW of pumped-storage power stations (STEP) in France. These enable energy to be stored using high-altitude water retention basins.,Opportunity
"Rather than resorting to new resources, manufacturers prefer to focus on battery recycling. Renault boasts that it can recycle 70% of the total battery weight of its Zoé model, the best-selling electric car in Europe in 2016. And Tesla claims that 100% of the nickel used in its batteries can be reused.",Opportunity
"""I may be illiterate,"" smiles Chandramma, a sturdy 60-year-old who supervises seed banks in 70 villages on a voluntary basis, ""but I'm ready to demonstrate to any scientist that with natural manure and seeds that cost nothing, I produce healthier food than with expensive modern seeds. And that we enrich the soil instead of destroying it.""",Opportunity
"Rajendra Singh has rebuilt the ""johads"", rainwater retention basins.",Opportunity
"Bénédicte Manier also cites the example of Rajendra Singh, known in India as the ""Water Man"". In India, 90% of water is used by agriculture, half the country's states are under high water stress and the country is expected to run out of water by 2030. A situation that was already critical in the 80s. Arriving in 1985 in the small district of Alwar, in Rajasthan, one of the country's most arid states, the former doctor decided to rebuild the ""johads"", the basins that held back rainwater and helped it seep into the soil. And he succeeded. By teaming up with a local engineer and mobilizing the population, the reservoirs were refilled after two or three monsoons.",Opportunity
"Even today, ""they provide 700,000 people with drinking water. Farmers are among the richest in the region, with three harvests a year. And five rivers that no longer exist are flowing again,"" enthuses Bénédicte Manier. In March 2015, Rajendra Singh was awarded the prestigious Stockholm Water Prize (the ""Nobel Prize for Water"") for demonstrating that desertification and rural poverty are not inevitable.",Opportunity
"Waste: in its ""circular economy"" section, the law also includes several provisions designed to limit the use of resources. The aim is to halve the amount of waste sent to landfill by 2025. To achieve this, disposable and non-compostable plastic bags will be banned from January 1, 2016, supermarkets will have to donate their unsold food to associations, and programmed obsolescence will be penalized.",Opportunity
"Four years after the Fukushima tragedy, contaminated waste is piling up. Millions of cubic meters of soil and irradiated plants are piled up in plastic bags, hundreds of thousands of liters of radioactive water are stored around the plant... And no one knows how far the three melted reactor cores have sunk.",Risk
"The government has also turned to less clean sources of energy, notably thermal power, which uses fossil fuels. ""Thermal power plants ensure our energy production, particularly in times of drought, when they can take over,"" explains Franklin Miguel, energy specialist at the Getulio Vargas Foundation.",Opportunity
"In the Republic of Sakha, or Yakutia, freezing winters don't stop the sun from shining. Over most of its territory, equivalent to half of Europe, the Russian region is experimenting with the installation of photovoltaic panels for its many isolated villages, which until now have been heated and lit by small diesel power plants. In this region, only large population centres are connected to the electricity grid.",Opportunity
"Almost three times as much by 2020, while rivers in eastern China are already saturated. To achieve its goal, the government has revived controversial dam projects in the Himalayas. After the Mekong, it's the Yarlung Tsangpo River that's in the authorities' sights. Known in India as the Brahmaputra, it rises in south-western Tibet and flows eastwards through half the province. In this area, the river has formed the world's deepest valley, known as the ""Great Bend"". Reinforced by a 2800 m difference in altitude over 500 km, it develops an enormous power that has not escaped the attention of Chinese engineers.",Risk
"Downstream of the Yarlung, it's the neighbors in India and Bangladesh who fear drought. The Brahmaputra is essential to agriculture, particularly in the Assam region, which it waters and fertilizes with its silt. China defends itself by arguing that most of the works will be ""run-of-river"" dams, i.e. without any major impoundment. At the end of the chain, Bangladesh feels caught in a vice, as India plans to build over a hundred dams of various sizes on the river and its tributaries. The river will then have one of the highest concentrations of dams in the world.",Risk
"Alain Fradin, General Manager of the Confédération Nationale du Crédit Mutuel, brandished a standard application file: ""48 pages to fill in and if you make a mistake on a single line you don't get the 17,000 euros. Account managers have finally given up offering it!"" A simplified procedure should soon be adopted to boost the take-up of these loans.",Opportunity
"On Wednesday January 11, the French Economic, Social and Environmental Council (Conseil économique, social et environnemental - Cese) adopted an opinion on sobriety, with the aim of encouraging its development in society and in our lifestyles. A sign that the subject, which was still taboo a year ago, is becoming more democratic. Among the twenty or so recommendations are the need for a positive narrative to emerge, the organization of a national debate on the distribution of efforts, and the importance of negotiating the organization of work.",Opportunity
"A national debate on how to share the effort
""When we launched our work less than a year ago, there was a great deal of principled and ideological opposition to sobriety. But we were able to take a step towards each other to reach a consensus and agree that it is an essential element of the ecological transition,"" analyzes Sylvain Boucherand, Chairman of the Cese's Environment Commission. This opinion is the first step towards developing a policy of sobriety that will enable us to meet both environmental challenges and social inequalities"".",Opportunity
"SNCF controllers have mobilized on a Facebook page, in the manner of the Gilets jaunes. Although they took advantage of the legal framework of the strike notice filed by the unions, their movement went beyond staff representatives. These collectives mobilizing on social networks are on the rise, and illustrate the emergence of new forms of social protest.",Risk
"""Management hasn't managed to grasp the full extent of this malaise, and neither have the unions,"" says Stéphane Sirot, a historian specializing in labor relations, on France Inter. ""It's a movement that questions the institutional aspect of labor relations, which is having trouble capturing the expectations of a certain number of employees,"" he adds.",Risk
"Unions less close to the ground
An observation shared by SNCF unions, according to whom the 2018 reform that created the Comité social et économique (CSE) by merging the former works councils and Comité d'hygiène, de sécurité et de conditions de travail (CHSCT), has weakened labor relations in companies by distancing unionists from the field. ""Elected representatives have to deal with wider areas, and are caught up in compulsory negotiation processes that take up a lot of their time. This makes it harder for trade unions to mediate in the field,"" says Stéphane Sirot on France Inter.",Risk
"This lack of representation in the workplace is giving rise to demands from categories of staff who are struggling to make themselves heard. In early December, another Facebook-based collective, ""Doctors for Tomorrow"", also made its presence felt. Describing itself as ""apolitical and asyndical"", and with several thousand members on the social network, it called for a strike on December 1 and 2 to demand a doubling of consultation fees.",Opportunity
"At the SNCF, negotiations between unions and management have finally reached a successful conclusion, and the unions have lifted their strike notice for the New Year's Day weekend. However, the next test for the social climate is likely to come very soon. After the end-of-year wage negotiations, the presentation of the pension reform package on January 10 could once again give rise to new demands...",Risk
"Some are refusing to pay their energy bills, others are calling for wage increases... The return of inflation in Europe in 2022, after years of stability, is weighing heavily on the most vulnerable. Europe's citizens have been taking to the streets since the summer to express their dissatisfaction with the rising cost of living. As the year draws to a close, Novethic takes a look back at a selection of key events.",Risk
"Serial social tensions in Europe
Across Europe, social movements have emerged over the past year to protest against the rising cost of living. In the UK, a citizens' movement called ""Don't pay"" was launched this summer. It encourages the English to pledge not to pay their energy bills in protest against price rises. Above all, the country has been experiencing an unprecedented wave of strikes since the summer. Railway workers, customs officers and even nurses have decided to go on strike in the summer of 2022. After a brief truce during the funeral of Queen Elizabeth II, the strikes resumed in the autumn. The last few days of December promise to be particularly hot across the Channel.",Risk
"In Belgium, Austria, the Czech Republic, Germany... social movements have been multiplying all over Europe, calling for wage increases to keep pace with inflation. Tensions on the job market in many countries since the post-Covid recovery have indeed led to wage increases. But this was limited to 3.8% in Europe, according to figures compiled by the European Central Bank. A far cry from the 10% rise in prices...",Risk
"The end of December is proving to be a tense time in the UK. Strike action in a number of public sectors is emerging as the year draws to a close. Nearly a million British workers are expected to go on strike between now and December 31 to protest against the rising cost of living and stagnating wages. According to October figures, inflation in the UK exceeded 11% year-on-year.",Risk
"""No longer turning a blind eye to our value chains"".
Among these countries, France takes the inglorious title of second European country contributing most to modern slavery in the minerals sector, essential to the energy transition and digitization of our economies, behind Germany and ahead of Italy, according to another report published in mid-November by SDSN. A third of forced labor cases generated by European imports are located in North Korea, and 17% in Nigeria. ""Guillaume Lafortune reminds us: ""The message is not to say that we should repatriate everything back home, but that it is essential to stop turning a blind eye to our value chains.",Risk
"""Whether it's chips for virtual reality or cells for solar panels, these transitions will be powered by raw materials. Lithium and rare earths have already replaced gas and oil at the heart of our economy [...]. This is where our trade policy comes in. New partnerships will advance not only our vital interests, but also our values"", insisted Ursula von der Leyen, President of the European Commission, in her State of the Union address on September 14.",Opportunity
"Electric scooters, smartphones, food processors... 70% of French people associate Black Friday with excess and over-consumption, according to a study conducted by Harris Interactive for Green Friday and Maif. And they're not wrong. 53.6 million tons of electronic waste - the equivalent of 11 Cheops pyramids - were produced worldwide in 2019, including 12 million tons in Europe, according to the ""Global E-Waste Monitor"" report produced by several UN organizations.",Risk
"""Many product categories remain too unsustainable""
This progress has inspired the European Commission, which published a circular economy package in March, fleshed out this summer by a draft regulation on cell phones and tablets. This introduces a reparability score and new requirements on product construction. But consumer associations point to several limitations. One of the main ones is the failure to take into account the price of spare parts, an essential criterion included in the French reparability index.",Risk
"This Wednesday, November 23, workers at the Foxconn factory in Zhengzhou, central China, protested against the total confinement of the site due to Covid-19. Apple's main subcontractor thus finds itself at the heart of a new controversy, as social discontent mounts throughout the country in the face of the government's drastic health policy.",Risk
"It was at this huge industrial site, which usually employs some 200,000 people, most of whom live on site in dormitories, that protests broke out on Wednesday November 23. ""Let's defend our rights!"" call the employees, faced with the chaos and disorganization reigning on site.",Risk
"And with good reason: faced with an increase in the number of Covid-19 cases in recent months, the company decided to confine workers inside the factory. This untenable situation prompted hundreds of panicked workers to flee on foot in early November. To maintain production, Foxconn offered substantial bonuses to remaining employees and tried to recruit new workers by calling on members of the Chinese Communist Party and local villagers.",Risk
"A new scandal for the electronics giant, China's largest private-sector employer, with over a million employees across the country in some thirty factories and research institutes. Foxconn, Apple's main subcontractor, is regularly criticized for its poor working conditions.",Risk
"For several months now, China has been pulling out all the stops to secure its industrial production, while maintaining a highly restrictive zero Covid-19 health policy. But between strict confinements, mandatory quarantines for those testing positive and almost daily PCR tests, public discontent is growing.",Risk
"32 major groups commit
The age of employees remains an adjustment variable for companies, who prefer to let older employees go first when downsizing. However, some companies have introduced plans to keep people over 50 in employment. On March 10, 2022, at the initiative of Club Landoy, a demographic think-tank, and L'Oréal, 32 major companies signed a charter of ten commitments to promote the careers of seniors. These range from raising awareness throughout the company, to the development of seniors' skills, to recruitment ""at all career stages"".",Opportunity
"The government is considering the introduction of a senior index for companies. It would take into account factors such as the rate of training or recruitment of over-45s, the use of early retirement schemes, etc. This proposal comes from human resources directors, because it's difficult for them to make progress on something that isn't measured,"" analyzes Stéphanie Lecerf. We're in favor of it in principle, even if a single index on diversity within the company should suffice.""",Opportunity
"The population's uprising was put down in blood, and the civil society organizations behind the protest, including the NGO Viasma, were destroyed. Founded in 1996 by Ales Bialiatski, who has just been awarded the Nobel Peace Prize while in prison for obscure tax reasons, Viasma has supported the struggle for human rights and democracy in Belarus for over 20 years.",Risk
"The Paris Court of Appeal has reduced the sentences handed down to Didier Lombard, ex-CEO of France Télécom, and his number two Louis-Pierre Wenès. But it confirms the institutional moral harassment put in place by the group's managers in 2007-2008 to push employees to leave, which had led to a wave of suicides in the company.",Opportunity
"It took more than ten years for the case to reach a conclusion. The Paris Court of Appeal has convicted former France Télécom executives of institutional moral harassment. It confirms a ruling by the Correctional Court on December 20, 2019, which had for the first time validated this notion. The sentences of Didier Lombard, ex-CEO of France Télécom, and his number 2 Louis-Pierre Wenès were lightened, and they were each granted a total suspension of their one-year prison sentences, but they will still have to pay a fine of 15,000 euros. The group's former HR director, Olivier Barberot, who had also been sentenced by the criminal court to a year's imprisonment, eight months of which were suspended, and a fine of 15,000 euros, did not appeal.",Opportunity
"The court ruling comes more than ten years after the fact. In 2007-2008, the management of the group, which has since become Orange, implemented an ""unbridled"" downsizing policy. The group announced a redundancy plan aimed at cutting 22,000 jobs over three years, out of a total workforce of 120,000. Didier Lombard had described to group executives his determination to push employees out ""one way or another, through the window or the door"". The company's brutal methods had greatly deteriorated the social climate, triggering a wave of suicides.",Risk
"There are two dimensions to the human rights NGO's campaign against Meta in Burma. The first is to support the Rohingya in their fight for redress against the company. Their organizations began by addressing Meta directly, suggesting that it invest one million dollars in education programs in refugee camps in Bangladesh. Their request for funding (0.002% of Meta's $46.7 billion profits in 2021) was curtly refused on the grounds that ""Facebook does not participate directly in philanthropic activities"".",Risk
"In the wake of these revelations, which have sparked outrage, Facebook is trying to defend itself. The Meta Group (Facebook's parent company) claims that the search warrants it received from police ""did not mention abortion at all"" and came to it before the US Supreme Court's decision to strike down the federal right to abortion. ""Nothing in the valid warrants we received from local law enforcement in early June, before the Supreme Court decision, mentioned abortion,"" says Facebook spokesperson Andy Stone.",Risk
"After the questioning of the legality of abortion, experts immediately wondered about the position of tech giants, confronted with authorities seeking information on social media accounts. Fears about the use of private data are all the more acute as some conservative states are preparing legislation to give the same rights to a fetus as to a human from the moment of fertilization. So far, few tech giants have commented on their data protection strategy in this case. Yet these are fundamental ethical issues that are an integral part of any CSR policy.",Risk
"Sanofi is offering around 30 medicines at cost price in some 40 poor countries, most of them in Africa, but also in Syria and Asian countries such as Cambodia and Burma. The pharmaceutical giant has undertaken not to make a profit on remedies for common illnesses such as diabetes, cardiovascular disease, tuberculosis, malaria and cancer. These drugs are ""considered essential by the World Health Organization"" and ""cover a wide range of therapeutic areas"", Sanofi asserts. They include insulin and other molecules such as glibenclamide and oxaliplatin.",Opportunity
"Other laboratories get involved
Sanofi isn't the only laboratory to take action on behalf of poor countries. Last May, competitor Pfizer pledged to sell some of its medicines and vaccines at cost price to 45 poor countries, notably against Covid-19. In addition, the International Federation of Pharmaceutical Manufacturers and Associations (IFPMA), which brings together 38 major pharmaceutical companies, has made a proposal to the G7 and G20, dubbed the ""Berlin Declaration"", which promises to guarantee more equitable access to medicines for disadvantaged countries during future pandemics. ""We are ready to reserve an allocation of production time for these populations"", announces IFPMA. In return, the organization is calling for the maintenance of patents, which were recently lifted by the WTO on Covid vaccines.",Opportunity
"""Heavy consumers of ultra-processed foods are at greater risk of developing chronic diseases: type 2 diabetes, cardiovascular disease, obesity, irritable bowel syndrome..."", Anthony Fardet, a researcher in sustainable and holistic preventive nutrition at INRAE, reminds the association. While criticism is mounting, the market, boosted by the French's concern for the environment and animal welfare, is gaining momentum. According to Barclays Bank, plant-based substitutes will account for 10% of the meat market by 2030, compared with 1% today.",Opportunity
"Since Trump's election, the United States has been divided between Republicans and Democrats, and the divides seem irreconcilable. Businesses are part of this debate, which has taken on new importance with the Supreme Court's decision. Their funding of ""pro-life"" political leaders opposed to abortion is accused of encouraging the disappearance of this constitutional right. 13 multinationals, including Amazon, Coca-Cola and Walmart, are accused of having paid more than $15 million to elected officials, including the governors of the seven states that banned abortion on June 24. These states are Missouri, Arkansas, Oklahoma, South Dakota, Indiana, Tennessee and Texas. The latter state, the world's ninth-largest economy with a GDP of $1,900 billion, is home to multinationals such as Exxon, Dell Technologies, Texas Instrument and AT&T. At least two of these, AT&T and Exxon, are among the companies targeted for the hundreds of thousands of dollars given to anti-abortion politicians.",Risk
"For the moment, data from these apps is sold ""only"" for targeted advertising, but some conservative states are preparing legislation to give the same rights to a fetus as to a human from the moment of fertilization. This data could therefore help to incriminate mothers, and many women are recommending that these apps be deleted.",Risk
